{
  "schema_version": "1.0",
  "project_id": "TestProject",
  "calculation_id": "calc_voltage_drop_br_v3p3_top_trace_000001",
  "calculation_family": "voltage_drop",
  "target_type": "branch",
  "target_id": "br_v3p3_top_trace_group_000001",
  "branch_id": "br_v3p3_top_trace_group_000001",
  "rail_name": "V3P3",
  "net_name": "V3P3",
  "refdes": null,
  "pin": null,
  "source_artifacts": [
    {
      "artifact_type": "calculation_readiness",
      "path": "exports/TestProject-calculation-readiness-inventory.json",
      "record_id": "br_v3p3_top_trace_group_000001",
      "notes": "Current is explicitly unresolved."
    },
    {
      "artifact_type": "missing_data_manifest",
      "path": "exports/TestProject-missing-data-manifest.json",
      "record_id": "mdi_manifest_branch_current_unknown_v3p3_mdi_branch_current_unknown_branch_br_v3p3_top_trace_group_000001_copper_calculation_voltage_drop_calculation_thermal_calculation",
      "notes": "Manifest item blocks voltage drop until current model is known."
    }
  ],
  "evidence_refs": ["ev_geo_br_v3p3_top_trace_group_000001_length"],
  "inputs": {
    "trace_resistance": {"value": 0.0815, "unit": "ohm", "source": "trace_resistance"},
    "branch_current_a": null
  },
  "assumptions": [],
  "missing_inputs": [
    {
      "field": "branch_current_a",
      "reason": "Branch current is unresolved; voltage drop requires an explicit current value.",
      "required_for": ["voltage_drop"],
      "manifest_item_id": "mdi_manifest_branch_current_unknown_v3p3_mdi_branch_current_unknown_branch_br_v3p3_top_trace_group_000001_copper_calculation_voltage_drop_calculation_thermal_calculation",
      "recommended_resolution": "datasheet_extraction"
    }
  ],
  "blocked_by_manifest_items": [
    "mdi_manifest_branch_current_unknown_v3p3_mdi_branch_current_unknown_branch_br_v3p3_top_trace_group_000001_copper_calculation_voltage_drop_calculation_thermal_calculation"
  ],
  "units": {
    "current": "A",
    "resistance": "ohm",
    "voltage": "V"
  },
  "provenance": {
    "created_by": "calculation_schema_example",
    "created_at_utc": "2026-05-29T00:00:00Z",
    "source_stage": "PR17 examples",
    "notes": "Blocked input example only; no current inferred."
  },
  "confidence": 0.72,
  "human_review_needed": true
}
